{
  "ruleSetId": "secureguide-blueprint-mvp",
  "ruleSetVersion": "1.0.0",
  "engineCompatibility": "1.0.0",
  "status": "ACTIVE",
  "rules": [
    {
      "ruleId": "BR-ART-POL",
      "ruleVersion": "1.0.0",
      "stage": "ARTIFACT_TYPE",
      "priority": 1,
      "when": {
        "artifactTypes": [
          "ART-POL"
        ]
      },
      "then": {
        "actionPlanType": "POLICY_LIFECYCLE",
        "titleTemplate": "خطة سياسة معيارية",
        "actions": [
          {
            "actionCode": "ACT-POL-DRAFT",
            "semanticKey": "policy.draft",
            "title": "صياغة السياسة",
            "description": "تحديد الغرض والنطاق والأدوار والأحكام",
            "category": "IMPLEMENTATION",
            "phase": "IMPLEMENT",
            "taskable": true
          },
          {
            "actionCode": "ACT-POL-APPROVE",
            "semanticKey": "governance.approval",
            "title": "اعتماد السياسة",
            "description": "مراجعة السياسة واعتمادها من الصلاحية المناسبة",
            "category": "IMPLEMENTATION",
            "phase": "GOVERN",
            "taskable": true
          }
        ],
        "expectedOutputs": [
          {
            "outputCode": "OUT-POL",
            "semanticKey": "policy.document",
            "title": "وثيقة سياسة معتمدة",
            "description": "نسخة مضبوطة وقابلة للتتبع"
          }
        ],
        "evidence": [
          {
            "evidenceCode": "EVD-POL-APPROVAL",
            "semanticKey": "approval.record",
            "title": "سجل الاعتماد",
            "evidenceType": "ATTESTATION",
            "description": "إثبات المراجعة والاعتماد",
            "mandatory": false
          }
        ],
        "effortProfiles": [
          {
            "semanticKey": "effort.art-pol",
            "effortTypes": [
              "ANALYSIS",
              "IMPLEMENTATION",
              "REVIEW"
            ],
            "effortLevel": "MEDIUM",
            "skillRequirements": [
              "DOMAIN_KNOWLEDGE"
            ],
            "estimatedComplexity": "MEDIUM",
            "implementationMode": "INTERNAL"
          }
        ],
        "supportingAssets": [
          {
            "semanticKey": "template.art-pol",
            "assetType": "CHECKLIST",
            "title": "قائمة تحقق تنفيذية",
            "usage": "تهيئة ومراجعة التنفيذ",
            "availability": "SUGGESTED"
          }
        ],
        "suggestedSolutions": [
          {
            "semanticKey": "solution.art-pol",
            "solutionType": "PROCESS",
            "title": "مسار عمل معياري",
            "description": "مسار محايد تقنيًا لتنظيم التنفيذ والمراجعة",
            "recommendationLevel": "OPTIONAL",
            "vendorNeutral": true,
            "requiresHumanValidation": true,
            "prerequisites": [],
            "risks": [
              "يلزم تكييفه مع سياق المؤسسة"
            ]
          }
        ]
      },
      "rationale": "نوع العنصر ART-POL يحدد الهيكل الأساسي للخطة",
      "baseConfidence": 0.9
    },
    {
      "ruleId": "BR-ART-STD",
      "ruleVersion": "1.0.0",
      "stage": "ARTIFACT_TYPE",
      "priority": 2,
      "when": {
        "artifactTypes": [
          "ART-STD"
        ]
      },
      "then": {
        "actionPlanType": "STANDARD_BASELINE",
        "titleTemplate": "خطة معيار معيارية",
        "actions": [
          {
            "actionCode": "ACT-STD-DEFINE",
            "semanticKey": "standard.define",
            "title": "تعريف خط الأساس",
            "description": "تحديد القواعد والقيم القابلة للقياس",
            "category": "IMPLEMENTATION",
            "phase": "IMPLEMENT",
            "taskable": true
          },
          {
            "actionCode": "ACT-STD-EXCEPTION",
            "semanticKey": "exception.process",
            "title": "تحديد مسار الاستثناء",
            "description": "تعريف الموافقة والمدة والمعالجة للاستثناءات",
            "category": "IMPLEMENTATION",
            "phase": "GOVERN",
            "taskable": true
          }
        ],
        "expectedOutputs": [
          {
            "outputCode": "OUT-STD",
            "semanticKey": "standard.baseline",
            "title": "خط أساس معياري",
            "description": "معيار مضبوط وقابل للاختبار"
          }
        ],
        "evidence": [
          {
            "evidenceCode": "EVD-STD-TEST",
            "semanticKey": "standard.test.result",
            "title": "نتائج اختبار المعيار",
            "evidenceType": "REPORT",
            "description": "نتائج موثقة للتحقق من الالتزام",
            "mandatory": false
          }
        ],
        "effortProfiles": [
          {
            "semanticKey": "effort.art-std",
            "effortTypes": [
              "ANALYSIS",
              "IMPLEMENTATION",
              "REVIEW"
            ],
            "effortLevel": "MEDIUM",
            "skillRequirements": [
              "DOMAIN_KNOWLEDGE"
            ],
            "estimatedComplexity": "MEDIUM",
            "implementationMode": "INTERNAL"
          }
        ],
        "supportingAssets": [
          {
            "semanticKey": "template.art-std",
            "assetType": "CHECKLIST",
            "title": "قائمة تحقق تنفيذية",
            "usage": "تهيئة ومراجعة التنفيذ",
            "availability": "SUGGESTED"
          }
        ],
        "suggestedSolutions": [
          {
            "semanticKey": "solution.art-std",
            "solutionType": "PROCESS",
            "title": "مسار عمل معياري",
            "description": "مسار محايد تقنيًا لتنظيم التنفيذ والمراجعة",
            "recommendationLevel": "OPTIONAL",
            "vendorNeutral": true,
            "requiresHumanValidation": true,
            "prerequisites": [],
            "risks": [
              "يلزم تكييفه مع سياق المؤسسة"
            ]
          }
        ]
      },
      "rationale": "نوع العنصر ART-STD يحدد الهيكل الأساسي للخطة",
      "baseConfidence": 0.9
    },
    {
      "ruleId": "BR-ART-PRC",
      "ruleVersion": "1.0.0",
      "stage": "ARTIFACT_TYPE",
      "priority": 3,
      "when": {
        "artifactTypes": [
          "ART-PRC"
        ]
      },
      "then": {
        "actionPlanType": "PROCEDURE_EXECUTION",
        "titleTemplate": "خطة إجراء معيارية",
        "actions": [
          {
            "actionCode": "ACT-PRC-STEPS",
            "semanticKey": "procedure.steps",
            "title": "تفصيل خطوات الإجراء",
            "description": "تحديد التسلسل والمسؤوليات والمدخلات والمخرجات",
            "category": "IMPLEMENTATION",
            "phase": "IMPLEMENT",
            "taskable": true
          },
          {
            "actionCode": "ACT-PRC-EXERCISE",
            "semanticKey": "procedure.exercise",
            "title": "اختبار قابلية التنفيذ",
            "description": "تنفيذ تجربة موثقة والتحقق من نقاط التسليم",
            "category": "IMPLEMENTATION",
            "phase": "VERIFY",
            "taskable": true
          }
        ],
        "expectedOutputs": [
          {
            "outputCode": "OUT-PRC",
            "semanticKey": "procedure.runbook",
            "title": "دليل إجراء تشغيلي",
            "description": "خطوات قابلة للتنفيذ وإعادة الإنتاج"
          }
        ],
        "evidence": [
          {
            "evidenceCode": "EVD-PRC-RUN",
            "semanticKey": "execution.record",
            "title": "سجل تنفيذ",
            "evidenceType": "LOG",
            "description": "سجل زمني لتنفيذ الإجراء",
            "mandatory": false
          }
        ],
        "effortProfiles": [
          {
            "semanticKey": "effort.art-prc",
            "effortTypes": [
              "ANALYSIS",
              "IMPLEMENTATION",
              "REVIEW"
            ],
            "effortLevel": "MEDIUM",
            "skillRequirements": [
              "DOMAIN_KNOWLEDGE"
            ],
            "estimatedComplexity": "MEDIUM",
            "implementationMode": "INTERNAL"
          }
        ],
        "supportingAssets": [
          {
            "semanticKey": "template.art-prc",
            "assetType": "CHECKLIST",
            "title": "قائمة تحقق تنفيذية",
            "usage": "تهيئة ومراجعة التنفيذ",
            "availability": "SUGGESTED"
          }
        ],
        "suggestedSolutions": [
          {
            "semanticKey": "solution.art-prc",
            "solutionType": "PROCESS",
            "title": "مسار عمل معياري",
            "description": "مسار محايد تقنيًا لتنظيم التنفيذ والمراجعة",
            "recommendationLevel": "OPTIONAL",
            "vendorNeutral": true,
            "requiresHumanValidation": true,
            "prerequisites": [],
            "risks": [
              "يلزم تكييفه مع سياق المؤسسة"
            ]
          }
        ]
      },
      "rationale": "نوع العنصر ART-PRC يحدد الهيكل الأساسي للخطة",
      "baseConfidence": 0.9
    },
    {
      "ruleId": "BR-ART-CTR",
      "ruleVersion": "1.0.0",
      "stage": "ARTIFACT_TYPE",
      "priority": 4,
      "when": {
        "artifactTypes": [
          "ART-CTR"
        ]
      },
      "then": {
        "actionPlanType": "CONTROL_IMPLEMENTATION",
        "titleTemplate": "خطة ضابط معيارية",
        "actions": [
          {
            "actionCode": "ACT-CTR-DESIGN",
            "semanticKey": "control.design",
            "title": "تصميم الضابط",
            "description": "تحديد النطاق والمالك وآلية العمل",
            "category": "IMPLEMENTATION",
            "phase": "IMPLEMENT",
            "taskable": true
          },
          {
            "actionCode": "ACT-CTR-OPERATE",
            "semanticKey": "control.operate",
            "title": "تشغيل الضابط",
            "description": "تطبيق الضابط ومراقبة انتظام التشغيل",
            "category": "IMPLEMENTATION",
            "phase": "IMPLEMENT",
            "taskable": true
          }
        ],
        "expectedOutputs": [
          {
            "outputCode": "OUT-CTR",
            "semanticKey": "control.implementation",